product_name;product_price
Teclado E Mouse Logitech Mk120 Usb Com Fio;R$ 144,33
Teclado para Notebook bringIT compatível com Acer Aspire 4736 ABNT2, P;R$ 60,04
Teclado para Notebook bringIT compatível com Acer Aspire 4752Z 4752ZG;R$ 60,04
Teclado Mecânico Gamer Compact Ii Led Bright Gtc561;R$ 421,73
Teclado e mouse pad World Map Antiderrapante Extended Large;R$ 503,00
Teclado Acer Aspire V5-431-4407 Br Com Ç;R$ 53,71
Teclado Logitech K120 Conv Usb Pto;R$ 62,99
Teclado para Notebook bringIT compatível com Dell Part Number PK130OC1;R$ 61,44
Teclado para Notebook bringIT compatível com Acer Aspire 7741Z Preto;R$ 63,84
Teclado Notebook Acer Aspire V5-431P;R$ 53,71
Kit Teclado E Mouse Com Fio Multimidia Usb Multilaser;R$ 145,32
Kit De Teclado E Mouse Com Luz Impermeável Gamer Pc 3 Colo;R$ 495,00
Teclado para Notebook bringIT compatível com HP Pavilion G4-1135BR Pr;R$ 63,84
Teclado para Notebook bringIT compatível com Acer E1-531-2644 MP-09G33;R$ 53,58
Teclado para Notebook bringIT compatível com HP Pavilion G4-1370BR Pr;R$ 63,84
Teclado para Notebook bringIT compatível com HP Pavilion G4-1130BR Pr;R$ 63,84
Teclado Gamer Tecrado Multimidia Com Led Para Pc e Notebook;R$ 369,99
Teclado para Notebook bringIT compatível com Acer E1-531G MP-09G36PA-6;R$ 53,58
Capa Bag Master Luxo Para Teclado Casio Ctk-6200 Vermelho;R$ 429,88
Teclado para Notebook bringIT compatível com Acer Aspire 5250 5750 574;R$ 63,84
Teclado Iniciante Queens 61 Teclas Fonte E Microfone Estante;R$ 816,83
Teclado para Notebook bringIT compatível com eMachines D Series D732 A;R$ 56,24
Teclado Razer Ornata V3 Low Profile, Layout US, Preto;R$ 759,90
Teclado mecânico para jogos Redragon K671 RGB retroiluminado;R$ 368,85
Teclado Com Fio VXPRO VXKB110;R$ 29,99
Teclado Multimídia STORM-Z;R$ 29,99
Teclado com fio mn8236 107 teclas preto 1,5m monocron;R$ 29,99
Teclado, OEX, TC308, Teclados,;R$ 29,99
Mini Teclado Wireless Keyboard Mouse - Preto;R$ 30,27
Teclado Mini Keyboard Ch0270;R$ 30,27
Par Apoio Pino Pes Reposição Teclado Para Philips Serie G400;R$ 30,31
Teclado Multi USB 1,5m TC065 Slim Resistente à Água - Preto;R$ 30,31
Teclado Kb-3728u Preto Abnt2;R$ 30,51
Teclado com Fio USB Resistente à Água TC 193BU Multilaser;R$ 30,65
Hub Usb 7 Portas Usb 2.0 Pendrive Mouse Teclado Adaptado - BELLATOR;R$ 30,71
Hub Usb 2.0 7 Portas Alta Velocidade Pendrive Mouse Teclado - BELLATOR;R$ 31,22
Teclado C3Tech USB 1,20m ABNT2 Multimídia Preto - KB-M11BK;R$ 31,26
Teclado USB Multimídia K-MEX KM-2928U PRT - KMEX;R$ 31,53
Teclado Slim GT850 Goldentec;R$ 31,90
Teclado Numérico Usb Com Fio Knup Kp-2003A;R$ 31,90
Teclado Basico USB Preto OEX;R$ 31,90
Mini Teclado Wireless Pc Android Tv Smart;R$ 32,00
Mini Teclado Keyboard Sem Fio;R$ 32,12
Teclado C3Tech KB-M40BK Multimídia USB C/ Fio - Preto;R$ 32,31
Teclado Compacto Kb-d428 Usb Preto;R$ 32,47
Teclado Usb Jx-560 Preto - Quanhe;R$ 32,54
Teclado USB Bright;R$ 32,55
Teclado Mini Keyboard Air Mouse Touch Tv Sem Fio Smart;R$ 33,38
Teclado gamer SteelSeries Apex 7 TKL RGB;R$ 835,21
Teclado Gamer Huntsman V2 Chroma RGB com Apoio de Pulso RZ03-03930200-R3U1 - Razer;R$ 2.374,90
Teclado Gamer Redragon Dyaus 2 ABNT 2 K509RGB;R$ 132,21
Kit Teclado + Mouse Gamer 6400dpi Rgb Rainbow Ranger Grafite Fortrek;R$ 129,40
Combo Gamer XZONE, Teclado com 7 Cores de Iluminação + Mouse 3200 DPI - GTC-01;R$ 169,90
Teclado Mecânico Redragon Kumara RGB Preto Switch Preto K552RGB-1;R$ 327,88
Teclado Gamer Mecanico Sem Fio RGB Attack Shark K86 com Tela Multimidia;R$ 454,00
Teclado Mecânico Gamer Warrior Dunky, LED Rainbow, Switch Outemu Blue, ABNT2 - TC248;R$ 219,32
Teclado Mecânico Gamer Gamdias Hermes E3 RGB USB Switch Red -;R$ 336,52
Limpeza de teclado com escova macia Cleaner 5 em 1 Ferramentas multifuncionais de limpeza de computador, escova de limpeza de teclado, para laptop limpo, fone de ouvido, teclado, mesa e outras fendas;R$ 11,99
Teclado Multi com fio USB TC193;R$ 21,27
Teclado Numérico Usb 18 Teclas Exbom Bk-n30;R$ 16,90
Teclado E Mouse Recarregável Bluetooth TC250 Multilaser;R$ 159,80
OEX TC302 Teclado Rainbow,;R$ 169,40
TECLADO MULTIMíDIA USB MULTILASER- TC206;R$ 35,91
Teclado Multimidia Office USB com Apoio para Smartphone TC262;R$ 46,90
Kit Gamer Profissionl Teclado e Mouse Exbom BK-G3000 com Iluminação LED Acabamento em Metal Usb 2.0 Preto;R$ 82,90
Teclado Bright 0134 Numérico Retrátil Usb;R$ 39,90
Teclado Gamer Redragon Optico Broadsword K588rgb-pro;R$ 589,52
Teclado Mecânico Gamer Redragon Kala Branco Rgb Switch Red;R$ 309,90
TECLADO GAMER MEC RBW FORTREK BLACK HAWK;R$ 263,90
Kit Essential Teclado E Mouse Maxprint Usb Abnt2;R$ 48,00
Teclado Mecânico Gamer Logitech G413 Carbon Com Layout Abnt2, Iluminação , Usb Passthrough E Switch Exclusivo Romer-G;R$ 499,90
Teclado Gamer Mecanico RGB Cruiser DARK GREY Fortrek;R$ 377,46
