product_name;product_price
Teclado Gamer Redragon Fizz Pro 60% K616-rgb Qwerty Red;R$ 449,99
Teclado Mecânico Gamer Motospeed Ck61 Preto Switch Azul Rgb;R$ 470,80
Teclado Mecânico Gamer Redragon Kumara, Anti-Ghosting, Led Vermelho, S;R$ 168,99
Teclado Gamer Evus Tc-11B Jellybeans;R$ 78,59
Teclado Mecânico Gamer Redragon Draconic Branco Rgb;R$ 476,90
Teclado Acer Aspire V5-431-4689 Br Com Ç;R$ 53,71
Teclado Mecânico Gamer Redragon Kumara, Anti-Ghosting, Rgb, Switch Out;R$ 229,99
Teclado Redragon Elf Pro Clear Transparente Abnt2 s/ Crystal;R$ 567,53
Teclado Multimídia USB Knup KP-2008 Ergonômico Preto;R$ 81,42
Teclado Gamer Mecânico Fortrek Black Hawk Compact Rainbow f002;R$ 163,70
Teclado Sem Fio Logitech Mx Keys Mini, Iluminação Smart, Bluetooth, Us;R$ 749,99
Kit Teclado Musical Estudante 61 Teclas Multi Funções Queens;R$ 1.800,42
Teclado Mecânico Redragon Olaf Cinza Rgb Abnt2 Switch Brown;R$ 641,89
Teclado Mecânico Gamer Compacto Redragon Fizz Cinza E Branco;R$ 264,90
Teclado para Notebook bringIT compatível com HP Compaq Presario CQ43-2;R$ 63,84
Teclado Notebook Samsung Np-Rv415 -Cd4Br;R$ 55,79
Teclado Multi com fio USB TC193;R$ 21,27
Teclado C3TECH KB-M11BK USB Multimidia Preto;R$ 33,14
Teclado Mecânico Gamer Redragon Dragonborn, Rgb, 60%, Switch;R$ 204,46
Mini Teclado Keyboard Sem Fio Wireless Iluminado Luz Led;R$ 37,15
Rack Z Suporte Para Teclado Keyboard Piano Fixo Saty Sz02;R$ 607,82
Teclado para Notebook bringIT compatível com Lenovo Ideapad S145 82DJ;R$ 61,01
Teclado com Fio Numérico Conexão USB Cabo de 120cm c/ Tecla 000 Preto Multi - TC227;R$ 40,41
Teclado Mecânico Redragon Trundle Rgb Abnt2 Branco E Azul;R$ 393,31
Limpeza de teclado com escova macia Cleaner 5 em 1 Ferramentas multifuncionais de limpeza de computador, escova de limpeza de teclado, para laptop limpo, fone de ouvido, teclado, mesa e outras fendas;R$ 11,99
Teclado Membrana Matricial 4x4 16 Teclas para Arduino;R$ 13,90
Cabo Adaptador Otg Usb Pata Tablet teclado Keyboard Mouse;R$ 16,90
Teclado Numérico Usb 18 Teclas Exbom Bk-n30;R$ 16,90
Teclado Usb Multimidia Abnt2 Kb-m10bk Preto C3tech;R$ 17,78
Teclado Banson Tech Shertech-802 Português Brasil Cor Preto;R$ 17,99
Teclado Multimidia Daily USB ABNT II - MYMAX;R$ 18,51
Teclado Membrana Microondas Consul Cma20;R$ 20,00
Teclado Multi com fio USB TC193;R$ 21,27
Mini Teclado Numérico Usb Com Fio 18 Teclas Notebook Pc;R$ 21,99
Teclado Sem Fio Wireless Com Mouse Universal - Lelong Max;R$ 21,99
Teclado Numérico Usb 2.0 Com Fio e 18 Teclas - PONTO DO NERD;R$ 22,23
Membrana Teclado Microondas Electrolux MEF41Y Flat Azul;R$ 23,00
Membrana Teclado Microondas Electrolux Mef41;R$ 23,00
Painel Membrana Teclado Microondas Electrolux Eletrolux;R$ 24,33
Membrana teclado Para Microondas Panasonic Nnr 94bh Deluxe Grill senso;R$ 24,70
Teclado Duex Usb Kd-101l Dx Kb200 Preto;R$ 24,98
Teclado Multi ABNT2 - TC065;R$ 24,99
Teclado Universitario Com Fio ABNT2 USB Preto Max Print;R$ 25,90
Teclado USB Multimídia Bright - 0014;R$ 25,90
TECLADO BáSICO SLIM USB MULTILASER- TC204;R$ 25,99
Mini Teclado Numérico Portátil 18 Teclas Ergonômico Com Fio Para Noteb;R$ 26,01
Teclado Numérico Usb Dynamic 20 Teclas Cabo 1.8M Preto Dt91;R$ 26,62
Mini Teclado Sem Fio Touchpad Universal Al-313 Altomex - Keyboard;R$ 26,68
Teclado Gamer Mecânico Fortrek Gravity 80 TKL Preto;R$ 152,16
Teclado TANKER RGB T-TGK106 T-DAGGER;R$ 110,29
Teclado Mecanico Gamer Daksa Pto Rainbow Switch Abnt2;R$ 249,24
Teclado E Mouse Sem Fio Usb Dynamic Corp Abnt2/1600 Dpi - Cmw200;R$ 84,88
Controlador de teclado MIDI USB M-WAVE de 25 teclas com 8 pads de bateria retroiluminados, teclado dinâmico profissional semipesado Bluetooth, 8 botões e produção musical, software incluído (branco);R$ 355,50
C3Tech Teclado Gamer KGM-1200BK Mecanico Preto USB Layout ABNT2 Switch Blue Anti-ghosting Ergonômico Iluminação Multicores;R$ 199,90
Teclado para Notebook Acer Aspire E5-571-54MC | ABNT2;R$ 64,65
TECLADO CLASSIC USB 2 METROS - PTOCL2AB – ABNT2 – PCYES;R$ 68,78
Teclado Mecânico Redragon Mitra RGB Lunar White Switch K551W-RGB;R$ 246,94
Teclado Mecânico Gamer Redragon Mitra Rgb Switch;R$ 246,94
Teclado Redragon SURARA Pro RGB Branco (Switch Óptico Azul) K582W-RGB-PRO (PT-BLUE);R$ 255,42
Teclado Mecânico Gamer Redragon Dragonborn, Rgb, 60%, Switch;R$ 204,46
Teclado Gamer Dazz Predator Mecanico Rgb;R$ 328,26
Teclado Gamer Redragon Kumara Mecanico Rgb Switch Azul, K552rgb-1;R$ 524,32
Teclado Logitech K120 Conv Usb Pto;R$ 62,99
Teclado Sem fio Logitech MX KEYS S Cinza Claro com Layout Americano;R$ 709,99
Teclado Mecânico Gamer Redragon Kumara, Anti-Ghosting, Rgb, Switch Out;R$ 229,99
Teclado e mouse sem fio Dell Pro — KM5221W;R$ 189,00
Teclado Multimídia Dell KB216 - em Português;R$ 75,05
Redragon TECLADO MECANICO GAMER FIZZ RGB PRETO SWITCH MARROM;R$ 196,73
Teclado Mecânico TKL Gamer Pro Logitech Gx Blue Clicky;R$ 599,99
Teclado Mecânico Redragon Mitra Single Color Lunar Switch Marrom K551W;R$ 159,50
Teclado Gamer Kumara K552W Rgb Branco Outemu Brown Redragon, UNICO;R$ 257,05
Teclado Mecânico Gamer Redragon Kala Branco Rgb Switch Blue;R$ 389,99
